{
  "meta": {
    "recordingId": "rec-capture-context-demo",
    "t0": 1719403200000,
    "url": "https://app.example.com/demo",
    "title": "CaptureContext demo",
    "durationMs": 5000,
    "userAgent": "Mozilla/5.0 (Macintosh; Intel Mac OS X 10_15_7) AppleWebKit/537.36",
    "videoStartOffsetMs": 0,
    "micStartOffsetMs": 0,
    "videoDurationMs": 5000,
    "micDurationMs": 5000
  },
  "events": [
    {
      "id": "evt-cc-001",
      "type": "click",
      "ts": 1200,
      "url": "https://app.example.com/demo",
      "target": {
        "role": "button",
        "text": "Submit",
        "placeholder": null,
        "label": null,
        "nearbyText": null,
        "tag": "button",
        "cssPath": "main > button.submit",
        "bbox": { "x": 400, "y": 200, "w": 100, "h": 30 },
        "masked": false
      }
    }
  ],
  "screenshots": [
    {
      "id": "scr-cc-001",
      "ts": 1300,
      "eventId": "evt-cc-001",
      "confidence": "high",
      "width": 2560,
      "height": 1440,
      "captureContext": {
        "viewportWidth": 1280,
        "viewportHeight": 720,
        "devicePixelRatio": 2,
        "scrollX": 0,
        "scrollY": 480
      }
    }
  ],
  "generatedDoc": {
    "title": "Demo",
    "purpose": "Test captureContext contract",
    "audience": "Developers",
    "prerequisites": "None",
    "steps": [
      {
        "id": "step-1",
        "title": "Click Submit",
        "body": "Press the submit button.",
        "screenshotId": "scr-cc-001",
        "eventIds": ["evt-cc-001"],
        "needsReview": false,
        "screenshotAnnotation": {
          "enabled": true,
          "bbox": { "x": 800, "y": 400, "w": 200, "h": 60 },
          "coordinateSpace": "screenshotPixels",
          "confidence": "measured",
          "materializedFromEventId": "evt-cc-001"
        }
      }
    ],
    "warnings": [],
    "result": "Done"
  }
}
